{
  "featureName": "app-startup-runtime",
  "mode": "strict",
  "language": "typescript",
  "currentPhase": "1b",
  "phaseHistory": [
    {
      "from": "init",
      "to": "1a",
      "timestamp": "2026-05-11T03:03:44.573Z"
    },
    {
      "from": "1a",
      "to": "1b",
      "timestamp": "2026-05-11T03:03:44.575Z"
    }
  ],
  "iterations": {
    "1a": 1,
    "1b": 1
  },
  "proofObligations": [],
  "traceability": {
    "epicId": "VCSDD-app-startup-runtime-1778468269910",
    "beads": []
  },
  "gates": {},
  "sprintCount": 0,
  "createdAt": "2026-05-11T02:57:49.910Z",
  "updatedAt": "2026-05-11T03:03:44.575Z"
}
