{
  "featureName": "delete-note",
  "mode": "lean",
  "language": "typescript",
  "currentPhase": "2c",
  "phaseHistory": [
    {
      "from": "init",
      "to": "1a",
      "timestamp": "2026-05-03T04:49:22.334Z"
    },
    {
      "from": "1a",
      "to": "1b",
      "timestamp": "2026-05-03T04:49:22.336Z"
    },
    {
      "from": "1b",
      "to": "1c",
      "timestamp": "2026-05-03T05:15:33.840Z",
      "reason": "spec review iter-2 PASS (lean mode); 6/6 iter-1 findings resolved"
    },
    {
      "from": "1c",
      "to": "2a",
      "timestamp": "2026-05-03T05:17:31.602Z",
      "reason": "spec review PASS; beginning TDD red phase",
      "sprint": 1
    },
    {
      "from": "2a",
      "to": "2b",
      "timestamp": "2026-05-03T05:34:11.104Z",
      "reason": "red phase complete; beginning green phase",
      "sprint": 1
    },
    {
      "from": "2b",
      "to": "2c",
      "timestamp": "2026-05-03T05:47:06.168Z",
      "reason": "green phase complete; beginning refactor",
      "sprint": 1
    }
  ],
  "iterations": {
    "1a": 1,
    "1b": 1,
    "1c": 1,
    "2a": 1,
    "2b": 1,
    "2c": 1
  },
  "proofObligations": [],
  "traceability": {
    "epicId": "VCSDD-delete-note-1777783100087",
    "beads": []
  },
  "gates": {
    "1c": {
      "verdict": "PASS",
      "timestamp": "2026-05-03T05:15:33.842Z",
      "reviewedBy": "adversary",
      "details": {
        "iteration": 2,
        "findingCount": 1,
        "severity": "MINOR (non-blocking)",
        "resolvedFromIter1": "6/6"
      },
      "adversaryVerdict": "PASS",
      "adversaryReviewedAt": "2026-05-03T05:15:33.842Z"
    }
  },
  "sprintCount": 1,
  "createdAt": "2026-05-03T04:38:20.086Z",
  "updatedAt": "2026-05-03T05:47:06.168Z"
}
